Namespace(n_hid=256, epochs=120, batch=256, lr=0.0021, dt=0.042, gamma=2.7, epsilon=4.7, gamma_range=2.7, epsilon_range=4.7, cpu=False, check=False, no_friction=True, esn=True, inp_scaling=1.0, rho=0.99, leaky=1.0, lstm=False, use_test=True)
  0%|                                                   | 0/223 [00:00<?, ?it/s]  0%|▏                                          | 1/223 [00:01<04:09,  1.12s/it]  1%|▍                                          | 2/223 [00:01<01:58,  1.86it/s]  1%|▌                                          | 3/223 [00:01<01:17,  2.84it/s]  2%|▊                                          | 4/223 [00:01<00:57,  3.80it/s]  2%|▉                                          | 5/223 [00:01<00:46,  4.68it/s]  3%|█▏                                         | 6/223 [00:01<00:39,  5.44it/s]  3%|█▎                                         | 7/223 [00:01<00:35,  6.06it/s]  4%|█▌                                         | 8/223 [00:02<00:32,  6.54it/s]  4%|█▋                                         | 9/223 [00:02<00:30,  6.92it/s]  4%|█▉                                        | 10/223 [00:02<00:29,  7.17it/s]  5%|██                                        | 11/223 [00:02<00:28,  7.35it/s]  5%|██▎                                       | 12/223 [00:02<00:28,  7.51it/s]  6%|██▍                                       | 13/223 [00:02<00:27,  7.61it/s]  6%|██▋                                       | 14/223 [00:02<00:27,  7.70it/s]  7%|██▊                                       | 15/223 [00:02<00:26,  7.77it/s]  7%|███                                       | 16/223 [00:03<00:26,  7.81it/s]  8%|███▏                                      | 17/223 [00:03<00:26,  7.84it/s]  8%|███▍                                      | 18/223 [00:03<00:26,  7.86it/s]  9%|███▌                                      | 19/223 [00:03<00:25,  7.85it/s]  9%|███▊                                      | 20/223 [00:03<00:25,  7.87it/s]  9%|███▉                                      | 21/223 [00:03<00:25,  7.88it/s] 10%|████▏                                     | 22/223 [00:03<00:25,  7.89it/s] 10%|████▎                                     | 23/223 [00:03<00:25,  7.89it/s] 11%|████▌                                     | 24/223 [00:04<00:25,  7.90it/s] 11%|████▋                                     | 25/223 [00:04<00:25,  7.91it/s] 12%|████▉                                     | 26/223 [00:04<00:24,  7.92it/s] 12%|█████                                     | 27/223 [00:04<00:25,  7.83it/s] 13%|█████▎                                    | 28/223 [00:04<00:24,  7.80it/s] 13%|█████▍                                    | 29/223 [00:04<00:24,  7.79it/s] 13%|█████▋                                    | 30/223 [00:04<00:24,  7.77it/s] 14%|█████▊                                    | 31/223 [00:04<00:24,  7.77it/s] 14%|██████                                    | 32/223 [00:05<00:24,  7.76it/s] 15%|██████▏                                   | 33/223 [00:05<00:24,  7.75it/s] 15%|██████▍                                   | 34/223 [00:05<00:24,  7.75it/s] 16%|██████▌                                   | 35/223 [00:05<00:24,  7.76it/s] 16%|██████▊                                   | 36/223 [00:05<00:24,  7.76it/s] 17%|██████▉                                   | 37/223 [00:05<00:24,  7.75it/s] 17%|███████▏                                  | 38/223 [00:05<00:23,  7.73it/s] 17%|███████▎                                  | 39/223 [00:05<00:23,  7.73it/s] 18%|███████▌                                  | 40/223 [00:06<00:23,  7.78it/s] 18%|███████▋                                  | 41/223 [00:06<00:23,  7.79it/s] 19%|███████▉                                  | 42/223 [00:06<00:23,  7.80it/s] 19%|████████                                  | 43/223 [00:06<00:23,  7.79it/s] 20%|████████▎                                 | 44/223 [00:06<00:23,  7.78it/s] 20%|████████▍                                 | 45/223 [00:06<00:22,  7.78it/s] 21%|████████▋                                 | 46/223 [00:06<00:22,  7.78it/s] 21%|████████▊                                 | 47/223 [00:07<00:22,  7.77it/s] 22%|█████████                                 | 48/223 [00:07<00:22,  7.78it/s] 22%|█████████▏                                | 49/223 [00:07<00:22,  7.78it/s] 22%|█████████▍                                | 50/223 [00:07<00:22,  7.78it/s] 23%|█████████▌                                | 51/223 [00:07<00:22,  7.77it/s] 23%|█████████▊                                | 52/223 [00:07<00:22,  7.77it/s] 24%|█████████▉                                | 53/223 [00:07<00:21,  7.77it/s] 24%|██████████▏                               | 54/223 [00:07<00:21,  7.78it/s] 25%|██████████▎                               | 55/223 [00:08<00:21,  7.78it/s] 25%|██████████▌                               | 56/223 [00:08<00:21,  7.77it/s] 26%|██████████▋                               | 57/223 [00:08<00:21,  7.77it/s] 26%|██████████▉                               | 58/223 [00:08<00:21,  7.80it/s] 26%|███████████                               | 59/223 [00:08<00:20,  7.82it/s] 27%|███████████▎                              | 60/223 [00:08<00:20,  7.84it/s] 27%|███████████▍                              | 61/223 [00:08<00:20,  7.85it/s] 28%|███████████▋                              | 62/223 [00:08<00:20,  7.86it/s] 28%|███████████▊                              | 63/223 [00:09<00:20,  7.88it/s] 29%|████████████                              | 64/223 [00:09<00:20,  7.88it/s] 29%|████████████▏                             | 65/223 [00:09<00:20,  7.89it/s] 30%|████████████▍                             | 66/223 [00:09<00:19,  7.86it/s] 30%|████████████▌                             | 67/223 [00:09<00:19,  7.84it/s] 30%|████████████▊                             | 68/223 [00:09<00:19,  7.81it/s] 31%|████████████▉                             | 69/223 [00:09<00:19,  7.81it/s] 31%|█████████████▏                            | 70/223 [00:09<00:19,  7.80it/s] 32%|█████████████▎                            | 71/223 [00:10<00:19,  7.78it/s] 32%|█████████████▌                            | 72/223 [00:10<00:19,  7.78it/s] 33%|█████████████▋                            | 73/223 [00:10<00:19,  7.77it/s] 33%|█████████████▉                            | 74/223 [00:10<00:19,  7.76it/s] 34%|██████████████▏                           | 75/223 [00:10<00:19,  7.75it/s] 34%|██████████████▎                           | 76/223 [00:10<00:18,  7.75it/s] 35%|██████████████▌                           | 77/223 [00:10<00:18,  7.75it/s] 35%|██████████████▋                           | 78/223 [00:10<00:18,  7.76it/s] 35%|██████████████▉                           | 79/223 [00:11<00:18,  7.80it/s] 36%|███████████████                           | 80/223 [00:11<00:18,  7.87it/s] 36%|███████████████▎                          | 81/223 [00:11<00:18,  7.88it/s] 37%|███████████████▍                          | 82/223 [00:11<00:17,  7.84it/s] 37%|███████████████▋                          | 83/223 [00:11<00:17,  7.82it/s] 38%|███████████████▊                          | 84/223 [00:11<00:17,  7.80it/s] 38%|████████████████                          | 85/223 [00:11<00:17,  7.83it/s] 39%|████████████████▏                         | 86/223 [00:11<00:17,  7.84it/s] 39%|████████████████▍                         | 87/223 [00:12<00:17,  7.85it/s] 39%|████████████████▌                         | 88/223 [00:12<00:17,  7.86it/s] 40%|████████████████▊                         | 89/223 [00:12<00:17,  7.86it/s] 40%|████████████████▉                         | 90/223 [00:12<00:16,  7.84it/s] 41%|█████████████████▏                        | 91/223 [00:12<00:16,  7.86it/s] 41%|█████████████████▎                        | 92/223 [00:12<00:16,  7.87it/s] 42%|█████████████████▌                        | 93/223 [00:12<00:16,  7.87it/s] 42%|█████████████████▋                        | 94/223 [00:13<00:16,  7.88it/s] 43%|█████████████████▉                        | 95/223 [00:13<00:16,  7.90it/s] 43%|██████████████████                        | 96/223 [00:13<00:16,  7.89it/s] 43%|██████████████████▎                       | 97/223 [00:13<00:15,  7.88it/s] 44%|██████████████████▍                       | 98/223 [00:13<00:15,  7.83it/s] 44%|██████████████████▋                       | 99/223 [00:13<00:15,  7.82it/s] 45%|██████████████████▍                      | 100/223 [00:13<00:15,  7.76it/s] 45%|██████████████████▌                      | 101/223 [00:13<00:15,  7.74it/s] 46%|██████████████████▊                      | 102/223 [00:14<00:15,  7.75it/s] 46%|██████████████████▉                      | 103/223 [00:14<00:15,  7.81it/s] 47%|███████████████████                      | 104/223 [00:14<00:15,  7.77it/s] 47%|███████████████████▎                     | 105/223 [00:14<00:15,  7.78it/s] 48%|███████████████████▍                     | 106/223 [00:14<00:15,  7.76it/s] 48%|███████████████████▋                     | 107/223 [00:14<00:14,  7.76it/s] 48%|███████████████████▊                     | 108/223 [00:14<00:14,  7.80it/s] 49%|████████████████████                     | 109/223 [00:14<00:14,  7.82it/s] 49%|████████████████████▏                    | 110/223 [00:15<00:14,  7.84it/s] 50%|████████████████████▍                    | 111/223 [00:15<00:14,  7.85it/s] 50%|████████████████████▌                    | 112/223 [00:15<00:14,  7.86it/s] 51%|████████████████████▊                    | 113/223 [00:15<00:14,  7.83it/s] 51%|████████████████████▉                    | 114/223 [00:15<00:13,  7.81it/s] 52%|█████████████████████▏                   | 115/223 [00:15<00:13,  7.79it/s] 52%|█████████████████████▎                   | 116/223 [00:15<00:13,  7.78it/s] 52%|█████████████████████▌                   | 117/223 [00:15<00:13,  7.77it/s] 53%|█████████████████████▋                   | 118/223 [00:16<00:13,  7.78it/s] 53%|█████████████████████▉                   | 119/223 [00:16<00:13,  7.78it/s] 54%|██████████████████████                   | 120/223 [00:16<00:13,  7.79it/s] 54%|██████████████████████▏                  | 121/223 [00:16<00:13,  7.81it/s] 55%|██████████████████████▍                  | 122/223 [00:16<00:12,  7.84it/s] 55%|██████████████████████▌                  | 123/223 [00:16<00:12,  7.85it/s] 56%|██████████████████████▊                  | 124/223 [00:16<00:12,  7.84it/s] 56%|██████████████████████▉                  | 125/223 [00:16<00:12,  7.82it/s] 57%|███████████████████████▏                 | 126/223 [00:17<00:12,  7.83it/s] 57%|███████████████████████▎                 | 127/223 [00:17<00:12,  7.85it/s] 57%|███████████████████████▌                 | 128/223 [00:17<00:12,  7.84it/s] 58%|███████████████████████▋                 | 129/223 [00:17<00:12,  7.81it/s] 58%|███████████████████████▉                 | 130/223 [00:17<00:11,  7.79it/s] 59%|████████████████████████                 | 131/223 [00:17<00:11,  7.78it/s] 59%|████████████████████████▎                | 132/223 [00:17<00:11,  7.79it/s] 60%|████████████████████████▍                | 133/223 [00:18<00:11,  7.82it/s] 60%|████████████████████████▋                | 134/223 [00:18<00:11,  7.85it/s] 61%|████████████████████████▊                | 135/223 [00:18<00:11,  7.84it/s] 61%|█████████████████████████                | 136/223 [00:18<00:11,  7.85it/s] 61%|█████████████████████████▏               | 137/223 [00:18<00:11,  7.81it/s] 62%|█████████████████████████▎               | 138/223 [00:18<00:10,  7.78it/s] 62%|█████████████████████████▌               | 139/223 [00:18<00:10,  7.76it/s] 63%|█████████████████████████▋               | 140/223 [00:18<00:10,  7.76it/s] 63%|█████████████████████████▉               | 141/223 [00:19<00:10,  7.76it/s] 64%|██████████████████████████               | 142/223 [00:19<00:10,  7.77it/s] 64%|██████████████████████████▎              | 143/223 [00:19<00:10,  7.80it/s] 65%|██████████████████████████▍              | 144/223 [00:19<00:10,  7.81it/s] 65%|██████████████████████████▋              | 145/223 [00:19<00:09,  7.80it/s] 65%|██████████████████████████▊              | 146/223 [00:19<00:09,  7.78it/s] 66%|███████████████████████████              | 147/223 [00:19<00:09,  7.78it/s] 66%|███████████████████████████▏             | 148/223 [00:19<00:09,  7.78it/s] 67%|███████████████████████████▍             | 149/223 [00:20<00:09,  7.81it/s] 67%|███████████████████████████▌             | 150/223 [00:20<00:09,  7.81it/s] 68%|███████████████████████████▊             | 151/223 [00:20<00:09,  7.82it/s] 68%|███████████████████████████▉             | 152/223 [00:20<00:09,  7.80it/s] 69%|████████████████████████████▏            | 153/223 [00:20<00:08,  7.80it/s] 69%|████████████████████████████▎            | 154/223 [00:20<00:08,  7.83it/s] 70%|████████████████████████████▍            | 155/223 [00:20<00:08,  7.85it/s] 70%|████████████████████████████▋            | 156/223 [00:20<00:08,  7.85it/s] 70%|████████████████████████████▊            | 157/223 [00:21<00:08,  7.86it/s] 71%|█████████████████████████████            | 158/223 [00:21<00:08,  7.85it/s] 71%|█████████████████████████████▏           | 159/223 [00:21<00:08,  7.86it/s] 72%|█████████████████████████████▍           | 160/223 [00:21<00:08,  7.83it/s] 72%|█████████████████████████████▌           | 161/223 [00:21<00:07,  7.79it/s] 73%|█████████████████████████████▊           | 162/223 [00:21<00:07,  7.77it/s] 73%|█████████████████████████████▉           | 163/223 [00:21<00:07,  7.78it/s] 74%|██████████████████████████████▏          | 164/223 [00:21<00:07,  7.80it/s] 74%|██████████████████████████████▎          | 165/223 [00:22<00:07,  7.84it/s] 74%|██████████████████████████████▌          | 166/223 [00:22<00:07,  7.85it/s] 75%|██████████████████████████████▋          | 167/223 [00:22<00:07,  7.86it/s] 75%|██████████████████████████████▉          | 168/223 [00:22<00:07,  7.83it/s] 76%|███████████████████████████████          | 169/223 [00:22<00:06,  7.81it/s] 76%|███████████████████████████████▎         | 170/223 [00:22<00:06,  7.79it/s] 77%|███████████████████████████████▍         | 171/223 [00:22<00:06,  7.78it/s] 77%|███████████████████████████████▌         | 172/223 [00:23<00:06,  7.77it/s] 78%|███████████████████████████████▊         | 173/223 [00:23<00:06,  7.76it/s] 78%|███████████████████████████████▉         | 174/223 [00:23<00:06,  7.76it/s] 78%|████████████████████████████████▏        | 175/223 [00:23<00:06,  7.74it/s] 79%|████████████████████████████████▎        | 176/223 [00:23<00:06,  7.75it/s] 79%|████████████████████████████████▌        | 177/223 [00:23<00:05,  7.77it/s] 80%|████████████████████████████████▋        | 178/223 [00:23<00:05,  7.76it/s] 80%|████████████████████████████████▉        | 179/223 [00:23<00:05,  7.76it/s] 81%|█████████████████████████████████        | 180/223 [00:24<00:05,  7.66it/s] 81%|█████████████████████████████████▎       | 181/223 [00:24<00:05,  7.69it/s] 82%|█████████████████████████████████▍       | 182/223 [00:24<00:05,  7.71it/s] 82%|█████████████████████████████████▋       | 183/223 [00:24<00:05,  7.72it/s] 83%|█████████████████████████████████▊       | 184/223 [00:24<00:05,  7.73it/s] 83%|██████████████████████████████████       | 185/223 [00:24<00:04,  7.70it/s] 83%|██████████████████████████████████▏      | 186/223 [00:24<00:04,  7.73it/s] 84%|██████████████████████████████████▍      | 187/223 [00:24<00:04,  7.76it/s] 84%|██████████████████████████████████▌      | 188/223 [00:25<00:04,  7.75it/s] 85%|██████████████████████████████████▋      | 189/223 [00:25<00:04,  7.77it/s] 85%|██████████████████████████████████▉      | 190/223 [00:25<00:05,  5.60it/s] 86%|███████████████████████████████████      | 191/223 [00:25<00:05,  6.09it/s] 86%|███████████████████████████████████▎     | 192/223 [00:25<00:04,  6.51it/s] 87%|███████████████████████████████████▍     | 193/223 [00:25<00:04,  6.83it/s] 87%|███████████████████████████████████▋     | 194/223 [00:26<00:04,  7.08it/s] 87%|███████████████████████████████████▊     | 195/223 [00:26<00:03,  7.26it/s] 88%|████████████████████████████████████     | 196/223 [00:26<00:03,  7.40it/s] 88%|████████████████████████████████████▏    | 197/223 [00:26<00:03,  7.50it/s] 89%|████████████████████████████████████▍    | 198/223 [00:26<00:03,  7.57it/s] 89%|████████████████████████████████████▌    | 199/223 [00:26<00:03,  7.61it/s] 90%|████████████████████████████████████▊    | 200/223 [00:26<00:03,  7.64it/s] 90%|████████████████████████████████████▉    | 201/223 [00:26<00:02,  7.67it/s] 91%|█████████████████████████████████████▏   | 202/223 [00:27<00:02,  7.69it/s] 91%|█████████████████████████████████████▎   | 203/223 [00:27<00:02,  7.70it/s] 91%|█████████████████████████████████████▌   | 204/223 [00:27<00:02,  7.71it/s] 92%|█████████████████████████████████████▋   | 205/223 [00:27<00:02,  7.72it/s] 92%|█████████████████████████████████████▊   | 206/223 [00:27<00:02,  7.73it/s] 93%|██████████████████████████████████████   | 207/223 [00:27<00:02,  7.74it/s] 93%|██████████████████████████████████████▏  | 208/223 [00:27<00:01,  7.74it/s] 94%|██████████████████████████████████████▍  | 209/223 [00:27<00:01,  7.74it/s] 94%|██████████████████████████████████████▌  | 210/223 [00:28<00:01,  7.74it/s] 95%|██████████████████████████████████████▊  | 211/223 [00:28<00:01,  7.74it/s] 95%|██████████████████████████████████████▉  | 212/223 [00:28<00:01,  7.72it/s] 96%|███████████████████████████████████████▏ | 213/223 [00:28<00:01,  7.73it/s] 96%|███████████████████████████████████████▎ | 214/223 [00:28<00:01,  7.73it/s] 96%|███████████████████████████████████████▌ | 215/223 [00:28<00:01,  7.76it/s] 97%|███████████████████████████████████████▋ | 216/223 [00:28<00:00,  7.78it/s] 97%|███████████████████████████████████████▉ | 217/223 [00:28<00:00,  7.80it/s] 98%|████████████████████████████████████████ | 218/223 [00:29<00:00,  7.82it/s] 98%|████████████████████████████████████████▎| 219/223 [00:29<00:00,  7.82it/s] 99%|████████████████████████████████████████▍| 220/223 [00:29<00:00,  7.83it/s] 99%|████████████████████████████████████████▋| 221/223 [00:29<00:00,  7.81it/s]100%|████████████████████████████████████████▊| 222/223 [00:29<00:00,  7.79it/s]100%|█████████████████████████████████████████| 223/223 [00:29<00:00,  7.80it/s]100%|█████████████████████████████████████████| 223/223 [00:29<00:00,  7.50it/s]
/opt/conda/envs/env/lib/python3.12/site-packages/sklearn/linear_model/_logistic.py:473: ConvergenceWarning: lbfgs failed to converge after 1000 iteration(s) (status=1):
STOP: TOTAL NO. OF ITERATIONS REACHED LIMIT

Increase the number of iterations to improve the convergence (max_iter=1000).
You might also want to scale the data as shown in:
    https://scikit-learn.org/stable/modules/preprocessing.html
Please also refer to the documentation for alternative solver options:
    https://scikit-learn.org/stable/modules/linear_model.html#logistic-regression
  n_iter_i = _check_optimize_result(
  0%|                                                    | 0/30 [00:00<?, ?it/s]  3%|█▍                                          | 1/30 [00:00<00:04,  6.91it/s]  7%|██▉                                         | 2/30 [00:00<00:03,  7.82it/s] 10%|████▍                                       | 3/30 [00:00<00:03,  8.14it/s] 13%|█████▊                                      | 4/30 [00:00<00:03,  8.33it/s] 17%|███████▎                                    | 5/30 [00:00<00:02,  8.47it/s] 20%|████████▊                                   | 6/30 [00:00<00:02,  8.54it/s] 23%|██████████▎                                 | 7/30 [00:00<00:02,  8.56it/s] 27%|███████████▋                                | 8/30 [00:00<00:02,  8.61it/s] 30%|█████████████▏                              | 9/30 [00:01<00:02,  8.65it/s] 33%|██████████████▎                            | 10/30 [00:01<00:02,  8.67it/s] 37%|███████████████▊                           | 11/30 [00:01<00:02,  8.65it/s] 40%|█████████████████▏                         | 12/30 [00:01<00:02,  8.64it/s] 43%|██████████████████▋                        | 13/30 [00:01<00:01,  8.63it/s] 47%|████████████████████                       | 14/30 [00:01<00:01,  8.61it/s] 50%|█████████████████████▌                     | 15/30 [00:01<00:01,  8.61it/s] 53%|██████████████████████▉                    | 16/30 [00:01<00:01,  8.62it/s] 57%|████████████████████████▎                  | 17/30 [00:01<00:01,  8.66it/s] 60%|█████████████████████████▊                 | 18/30 [00:02<00:01,  8.63it/s] 63%|███████████████████████████▏               | 19/30 [00:02<00:01,  8.63it/s] 67%|████████████████████████████▋              | 20/30 [00:02<00:01,  8.67it/s] 70%|██████████████████████████████             | 21/30 [00:02<00:01,  8.68it/s] 73%|███████████████████████████████▌           | 22/30 [00:02<00:00,  8.70it/s] 77%|████████████████████████████████▉          | 23/30 [00:02<00:00,  8.71it/s] 80%|██████████████████████████████████▍        | 24/30 [00:02<00:00,  8.72it/s] 83%|███████████████████████████████████▊       | 25/30 [00:02<00:00,  8.73it/s] 87%|█████████████████████████████████████▎     | 26/30 [00:03<00:00,  8.74it/s] 90%|██████████████████████████████████████▋    | 27/30 [00:03<00:00,  8.73it/s] 93%|████████████████████████████████████████▏  | 28/30 [00:03<00:00,  8.70it/s] 97%|█████████████████████████████████████████▌ | 29/30 [00:03<00:00,  8.66it/s]100%|███████████████████████████████████████████| 30/30 [00:03<00:00,  8.63it/s]100%|███████████████████████████████████████████| 30/30 [00:03<00:00,  8.59it/s]
  0%|                                                   | 0/100 [00:00<?, ?it/s]  1%|▍                                          | 1/100 [00:00<00:13,  7.15it/s]  2%|▊                                          | 2/100 [00:00<00:12,  7.93it/s]  3%|█▎                                         | 3/100 [00:00<00:11,  8.20it/s]  4%|█▋                                         | 4/100 [00:00<00:11,  8.34it/s]  5%|██▏                                        | 5/100 [00:00<00:11,  8.46it/s]  6%|██▌                                        | 6/100 [00:00<00:11,  8.54it/s]  7%|███                                        | 7/100 [00:00<00:10,  8.59it/s]  8%|███▍                                       | 8/100 [00:00<00:10,  8.61it/s]  9%|███▊                                       | 9/100 [00:01<00:10,  8.63it/s] 10%|████▏                                     | 10/100 [00:01<00:10,  8.65it/s] 11%|████▌                                     | 11/100 [00:01<00:10,  8.67it/s] 12%|█████                                     | 12/100 [00:01<00:10,  8.69it/s] 13%|█████▍                                    | 13/100 [00:01<00:09,  8.71it/s] 14%|█████▉                                    | 14/100 [00:01<00:09,  8.72it/s] 15%|██████▎                                   | 15/100 [00:01<00:09,  8.69it/s] 16%|██████▋                                   | 16/100 [00:01<00:09,  8.64it/s] 17%|███████▏                                  | 17/100 [00:01<00:09,  8.66it/s] 18%|███████▌                                  | 18/100 [00:02<00:09,  8.66it/s] 19%|███████▉                                  | 19/100 [00:02<00:09,  8.66it/s] 20%|████████▍                                 | 20/100 [00:02<00:09,  8.68it/s] 21%|████████▊                                 | 21/100 [00:02<00:09,  8.68it/s] 22%|█████████▏                                | 22/100 [00:02<00:08,  8.68it/s] 23%|█████████▋                                | 23/100 [00:02<00:08,  8.70it/s] 24%|██████████                                | 24/100 [00:02<00:08,  8.68it/s] 25%|██████████▌                               | 25/100 [00:02<00:08,  8.65it/s] 26%|██████████▉                               | 26/100 [00:03<00:08,  8.62it/s] 27%|███████████▎                              | 27/100 [00:03<00:08,  8.62it/s] 28%|███████████▊                              | 28/100 [00:03<00:08,  8.59it/s] 29%|████████████▏                             | 29/100 [00:03<00:08,  8.58it/s] 30%|████████████▌                             | 30/100 [00:03<00:08,  8.59it/s] 31%|█████████████                             | 31/100 [00:03<00:08,  8.59it/s] 32%|█████████████▍                            | 32/100 [00:03<00:07,  8.63it/s] 33%|█████████████▊                            | 33/100 [00:03<00:07,  8.63it/s] 34%|██████████████▎                           | 34/100 [00:03<00:07,  8.62it/s] 35%|██████████████▋                           | 35/100 [00:04<00:07,  8.61it/s] 36%|███████████████                           | 36/100 [00:04<00:07,  8.60it/s] 37%|███████████████▌                          | 37/100 [00:04<00:07,  8.59it/s] 38%|███████████████▉                          | 38/100 [00:04<00:07,  8.58it/s] 39%|████████████████▍                         | 39/100 [00:04<00:07,  8.58it/s] 40%|████████████████▊                         | 40/100 [00:04<00:07,  8.57it/s] 41%|█████████████████▏                        | 41/100 [00:04<00:06,  8.57it/s] 42%|█████████████████▋                        | 42/100 [00:04<00:06,  8.56it/s] 43%|██████████████████                        | 43/100 [00:05<00:06,  8.57it/s] 44%|██████████████████▍                       | 44/100 [00:05<00:06,  8.59it/s] 45%|██████████████████▉                       | 45/100 [00:05<00:06,  8.62it/s] 46%|███████████████████▎                      | 46/100 [00:05<00:06,  8.61it/s] 47%|███████████████████▋                      | 47/100 [00:05<00:06,  8.59it/s] 48%|████████████████████▏                     | 48/100 [00:05<00:06,  8.59it/s] 49%|████████████████████▌                     | 49/100 [00:05<00:05,  8.59it/s] 50%|█████████████████████                     | 50/100 [00:05<00:05,  8.59it/s] 51%|█████████████████████▍                    | 51/100 [00:05<00:05,  8.58it/s] 52%|█████████████████████▊                    | 52/100 [00:06<00:05,  8.57it/s] 53%|██████████████████████▎                   | 53/100 [00:06<00:05,  8.57it/s] 54%|██████████████████████▋                   | 54/100 [00:06<00:05,  8.57it/s] 55%|███████████████████████                   | 55/100 [00:06<00:05,  8.57it/s] 56%|███████████████████████▌                  | 56/100 [00:06<00:05,  8.57it/s] 57%|███████████████████████▉                  | 57/100 [00:06<00:05,  8.58it/s] 58%|████████████████████████▎                 | 58/100 [00:06<00:04,  8.59it/s] 59%|████████████████████████▊                 | 59/100 [00:06<00:04,  8.54it/s] 60%|█████████████████████████▏                | 60/100 [00:06<00:04,  8.55it/s] 61%|█████████████████████████▌                | 61/100 [00:07<00:04,  8.57it/s] 62%|██████████████████████████                | 62/100 [00:07<00:04,  8.57it/s] 63%|██████████████████████████▍               | 63/100 [00:07<00:04,  8.56it/s] 64%|██████████████████████████▉               | 64/100 [00:07<00:04,  8.57it/s] 65%|███████████████████████████▎              | 65/100 [00:07<00:04,  8.58it/s] 66%|███████████████████████████▋              | 66/100 [00:07<00:03,  8.58it/s] 67%|████████████████████████████▏             | 67/100 [00:07<00:03,  8.58it/s] 68%|████████████████████████████▌             | 68/100 [00:07<00:03,  8.58it/s] 69%|████████████████████████████▉             | 69/100 [00:08<00:03,  8.58it/s] 70%|█████████████████████████████▍            | 70/100 [00:08<00:03,  8.58it/s] 71%|█████████████████████████████▊            | 71/100 [00:08<00:03,  8.58it/s] 72%|██████████████████████████████▏           | 72/100 [00:08<00:03,  8.57it/s] 73%|██████████████████████████████▋           | 73/100 [00:08<00:03,  8.57it/s] 74%|███████████████████████████████           | 74/100 [00:08<00:03,  8.57it/s] 75%|███████████████████████████████▌          | 75/100 [00:08<00:02,  8.58it/s] 76%|███████████████████████████████▉          | 76/100 [00:08<00:02,  8.58it/s] 77%|████████████████████████████████▎         | 77/100 [00:08<00:02,  8.60it/s] 78%|████████████████████████████████▊         | 78/100 [00:09<00:02,  8.59it/s] 79%|█████████████████████████████████▏        | 79/100 [00:09<00:02,  8.58it/s] 80%|█████████████████████████████████▌        | 80/100 [00:09<00:02,  8.58it/s] 81%|██████████████████████████████████        | 81/100 [00:09<00:02,  8.57it/s] 82%|██████████████████████████████████▍       | 82/100 [00:09<00:02,  8.53it/s] 83%|██████████████████████████████████▊       | 83/100 [00:09<00:01,  8.54it/s] 84%|███████████████████████████████████▎      | 84/100 [00:09<00:01,  8.59it/s] 85%|███████████████████████████████████▋      | 85/100 [00:09<00:01,  8.62it/s] 86%|████████████████████████████████████      | 86/100 [00:10<00:01,  8.57it/s] 87%|████████████████████████████████████▌     | 87/100 [00:10<00:01,  8.57it/s] 88%|████████████████████████████████████▉     | 88/100 [00:10<00:01,  8.58it/s] 89%|█████████████████████████████████████▍    | 89/100 [00:10<00:01,  8.57it/s] 90%|█████████████████████████████████████▊    | 90/100 [00:10<00:01,  8.57it/s] 91%|██████████████████████████████████████▏   | 91/100 [00:10<00:01,  8.60it/s] 92%|██████████████████████████████████████▋   | 92/100 [00:10<00:00,  8.64it/s] 93%|███████████████████████████████████████   | 93/100 [00:10<00:00,  8.61it/s] 94%|███████████████████████████████████████▍  | 94/100 [00:10<00:00,  8.61it/s] 95%|███████████████████████████████████████▉  | 95/100 [00:11<00:00,  8.59it/s] 96%|████████████████████████████████████████▎ | 96/100 [00:11<00:00,  8.58it/s] 97%|████████████████████████████████████████▋ | 97/100 [00:11<00:00,  8.58it/s] 98%|█████████████████████████████████████████▏| 98/100 [00:11<00:00,  8.62it/s] 99%|█████████████████████████████████████████▌| 99/100 [00:11<00:00,  8.65it/s]100%|█████████████████████████████████████████| 100/100 [00:11<00:00,  8.68it/s]100%|█████████████████████████████████████████| 100/100 [00:11<00:00,  8.59it/s]

************** FINAL SUMMARY **************
n_hid: 256
epochs: 120
batch: 256
lr: 0.0021
dt: 0.042
gamma: 2.7
epsilon: 4.7
gamma_range: 2.7
epsilon_range: 4.7
cpu: False
check: False
no_friction: True
esn: True
inp_scaling: 1.0
rho: 0.99
leaky: 1.0
lstm: False
use_test: True
Valid accuracy: 0.72
Test accuracy: 0.71
*******************************************

